{
  "display_slices": [
    0,
    1,
    2,
    3,
    4,
    5,
    6
  ],
  "grid_id": "synthetic-10um-grid-v1",
  "id": "horizontal",
  "kind": "registered-slice-stack",
  "plane_index_to_world_um": [
    0,
    10,
    0,
    -35,
    0,
    0,
    -10,
    40,
    -10,
    0,
    0,
    20,
    0,
    0,
    0,
    1
  ],
  "reference_space_id": "allen-ccf-2017",
  "resource_index": {
    "format": "atlas-registered-svg-resource-index-v1",
    "resource": {
      "bytes": 293,
      "codec": {
        "decoded_bytes": 407,
        "name": "gzip"
      },
      "media_type": "application/json",
      "path": "horizontal-index.json.gz",
      "sha256": "c2d61cc78a48d5c774c3fdb7d8e3a38299a51a643de5682e8efaaafbd85f7618"
    }
  },
  "slice_count": 7,
  "slice_shape": [
    8,
    9
  ],
  "view_box": [
    0,
    0,
    8,
    9
  ],
  "voxel_edge_extent_um": [
    -40,
    40,
    -45,
    45,
    -45,
    25
  ],
  "world_slice_axis": "dv"
}
